country	group	sector	subsector	id	company_name	company_city	company_headcount	supplier_of	site_status	verified_by_europages	year_established	main_activity	information	websites	address	postcode	keywords	products	products_language	chunk	lat	long
spain	agriculture_livestock	animals_livestock	NA	GRUPCARN-SA_00000003734763-121699001	GRUPCARN S.A.	SABADELL	1 - 10	calves and cattle, slaughter	Registered office	FALSE		Manufacturer/ Producer	The company GRUPCARN S.A., is a Manufacturer/ Producer, which operates in the Calves and cattle, slaughter industry. It is based in SABADELL, Spain.		CALLE COSTA I DEU 115-125 	08415	Calves and cattle, slaughter	NA	NA	22	41.67408173235294	2.2066662220224322
spain	agriculture_livestock	animals_livestock	NA	PESQUERIAS-DE-ALMADRABA-SA_ESP124606-00101	PESQUERIAS DE ALMADRABA SA	Barbate	51 - 100	fish, salt-water | fish	Registered office	FALSE		Manufacturer/ Producer	The company PESQUERIAS DE ALMADRABA SA, is a Manufacturer/ Producer, which operates in the Fish industry. It also operates in the Fish, salt-water industries. It is based in Barbate, Spain.	http://www.almadrabas.com	Generalisimo, 200 	11160	Fish, Fish, salt-water	NA	NA	22	36.1897380060606	-5.9367638642718195
spain	agriculture_livestock	animals_livestock	NA	INSVET-S-A_ESP136946-00101	INSVET S A	Esplus	11 - 50	veterinary services | livestock - services	Registered office	FALSE		Service Provider	The company INSVET S A, is a Service Provider, which operates in the Livestock - services industry. It also operates in the Veterinary services industries. It is based in Esplus, Spain.		Carretera Alta 43 	22535	Livestock - services, Veterinary services	NA	NA	22	NA	NA
spain	agriculture_livestock	animals_livestock	NA	ARS-VETERINARIA-SLP_ESP177059-00101	ARS VETERINARIA SLP	Barcelona	11 - 50	veterinary services | livestock - services	Registered office	FALSE			The company ARS VETERINARIA SLP, which operates in the Livestock - services industry. It also operates in the Veterinary services industries. It is based in Barcelona, Spain.	http://www.arsveterinaria.es	Cardedeu, 3 	08023	Livestock - services, Veterinary services	NA	NA	22	41.41137017793489	2.1454349932077608
spain	agriculture_livestock	animals_livestock	NA	FRIGORIFICOS-FANDINO-SA_ESP005343-00101	FRIGORIFICOS FANDINO SA	Vigo	51 - 100	fish, salt-water | fish	Registered office	FALSE		Wholesaler	The company FRIGORIFICOS FANDINO SA, is a Wholesaler, which operates in the Fish, salt-water industry. It also operates in the Fish industries. It is based in Vigo, Spain.	http://www.fandino.es	Jose Rivas (Coruxo), 21 	36330	Fish, salt-water, Fish	NA	NA	22	42.1907689	-8.776290905769395
spain	agriculture_livestock	animals_livestock	NA	BAENAS-EXPORTIMPORT-SL_ESP146204-00101	BAENAS EXPORT-IMPORT S.L.	Lorca	1 - 10	calves and cattle, slaughter | cattle	Registered office	FALSE		Wholesaler	The company BAENAS EXPORT-IMPORT S.L., is a Wholesaler, which operates in the Cattle industry. It also operates in the Calves and cattle, slaughter industries. It is based in Lorca, Spain.		Calle Purias, S/N 	30800	Cattle, Calves and cattle, slaughter	NA	NA	22	37.904515033333325	-1.7100220935142938
spain	agriculture_livestock	animals_livestock	NA	DISTRIBUIDORA-DE-ALIMENTOS-ESPECIALES-SA_ESP009402-00101	DISTRIBUIDORA DE ALIMENTOS ESPECIALES SA	Lugones	11 - 50	cat food | birdseed | dog food		FALSE		Wholesaler	The company DISTRIBUIDORA DE ALIMENTOS ESPECIALES SA, is a Wholesaler, which operates in the Dog food industry. It also operates in the Birdseed, and Cat food industries. It is based in Lugones, Spain.		Lugar Cabañas 634 Local 32 	33420	Dog food, Birdseed, Cat food	NA	NA	22	43.40494080576923	-5.810979299314095
spain	agriculture_livestock	animals_livestock	NA	BORSAO-IMPORTEXPORT-SL_00000003567475-68384001	BORSAO IMPORT-EXPORT SL	Madrid	1 - 10	fish, salt-water | frozen seafood		FALSE		Distributor	The company BORSAO IMPORT-EXPORT SL, is a Distributor, which operates in the Fish, salt-water industry. It also operates in the frozen seafood industries. It is based in Madrid, Spain.		Pl. Mariano De Cavia, 1 	28007	Fish, salt-water, frozen seafood	NA	NA	22	40.40730407051379	-3.672130008030556
spain	agriculture_livestock	animals_livestock	NA	PRODUCTORES-GANADEROS-Y-TECNICOS-ASOCIADOS-SA_ESP007359-00101	PRODUCTORES GANADEROS Y TECNICOS ASOCIADOS SA	Valladolid	11 - 50	premix for livestock and poultry | feeds for animal farming	Registered office	FALSE		Manufacturer/ Producer	The company PRODUCTORES GANADEROS Y TECNICOS ASOCIADOS SA, is a Manufacturer/ Producer, which operates in the Feeds for animal farming industry. It also operates in the Premix for livestock and poultry industries. It is based in Valladolid, Spain.		Viejo De Simancas (Km 4) 	47008	Feeds for animal farming, Premix for livestock and poultry	NA	NA	22	41.618440399616894	-4.747580661175462
spain	agriculture_livestock	animals_livestock	NA	EXPLOTACIONES-GANADERAS-EL-CRUCE-SL_ESP157387-00101	EXPLOTACIONES GANADERAS EL CRUCE SL	Badajoz	51 - 100	aquaculture and pisciculture | fish	Registered office	FALSE			The company EXPLOTACIONES GANADERAS EL CRUCE SL, which operates in the Fish industry. It also operates in the Aquaculture and pisciculture industries. It is based in Badajoz, Spain.	http://www.granjaelcruce.com	Antonio Nevado Gonzalez -Pg El Never P610, S/N 	06007	Fish, Aquaculture and pisciculture	NA	NA	22	38.8905646525	-6.976343830617805
spain	agriculture_livestock	animals_livestock	NA	DIVALEKISA-SL_00000003656387-95995001	DIVAL-EKISA, S.L.	Carlet (valencia)	1 - 10	pet birds		FALSE		Manufacturer/ Producer	The company DIVAL-EKISA, S.L., is a Manufacturer/ Producer, which operates in the Pet birds industry. It is based in Carlet (valencia), Spain.	http://www.dival-ekisa.com	C/ Llevant, 12 	46240	Pet birds	NA	NA	22	39.22561615555556	-0.5227778177021052
spain	agriculture_livestock	animals_livestock	NA	HARINAS-DE-ANDALUCIA-SA_ESP015270-00101	HARINAS DE ANDALUCIA SA	Tarifa	11 - 50	fish meal for livestock and poultry | feed for fish farming | feeds for animal farming	Registered office	FALSE		Manufacturer/ Producer	The company HARINAS DE ANDALUCIA SA, is a Manufacturer/ Producer, which operates in the Feed for fish farming industry. It also operates in the Feeds for animal farming, and Fish meal for livestock and poultry industries. It is based in Tarifa, Spain.		Calle Numancia 3 	11380	Feed for fish farming, Feeds for animal farming, Fish meal for livestock and poultry	NA	NA	22	36.016976074561384	-5.607567600338968
spain	agriculture_livestock	animals_livestock	NA	INVE-ANIMAL-HEALTH-SA_ESP064266-00101	INVE ANIMAL HEALTH SA	Vigo	1 - 10	aquaculture and pisciculture | fish | pet foods	Registered office	FALSE		Wholesaler	The company INVE ANIMAL HEALTH SA, is a Wholesaler, which operates in the Fish industry. It also operates in the Aquaculture and pisciculture, and Pet foods industries. It is based in Vigo, Spain.		Carretera Camposancos 117 	36213	Fish, Aquaculture and pisciculture, Pet foods	NA	NA	22	42.203854385	-8.740031778567397
spain	agriculture_livestock	animals_livestock	NA	SOCIEDAD-COOPERATIVA-LIMITADA-LA-OTURENSE_ESP039433-00101	SOCIEDAD COOPERATIVA LIMITADA LA OTURENSE	Valdes	11 - 50	premix for livestock and poultry | feeds for animal farming	Registered office	FALSE		Manufacturer/ Producer	The company SOCIEDAD COOPERATIVA LIMITADA LA OTURENSE, is a Manufacturer/ Producer, which operates in the Feeds for animal farming industry. It also operates in the Premix for livestock and poultry industries. It is based in Valdes, Spain.	http://www.laoturense.com	Rio Mayor - Otur 	33700	Feeds for animal farming, Premix for livestock and poultry	NA	NA	22	43.54440475	-6.531914616090443
spain	agriculture_livestock	animals_livestock	NA	MONTALBAN-PIENSOS-COMPUESTOS-SL_ESP147710-00101	MONTALBAN PIENSOS COMPUESTOS S.L.	Almacelles	11 - 50	calves and cattle, slaughter | cattle	Registered office	FALSE		Wholesaler	The company MONTALBAN PIENSOS COMPUESTOS S.L., is a Wholesaler, which operates in the Cattle industry. It also operates in the Calves and cattle, slaughter industries. It is based in Almacelles, Spain.	http://www.gmontalban.com	Nacional 240 (Km 113) 	25100	Cattle, Calves and cattle, slaughter	NA	NA	22	41.729801466666665	0.4433573152049776
spain	agriculture_livestock	animals_livestock	NA	PESCADOS-CHEON_00000004452166-301688001	PESCADOS CHÉON	Cádiz	11 - 50	fish, salt-water		FALSE		Wholesaler	The company PESCADOS CHÉON, is a Wholesaler, which operates in the Fish, salt-water industry. It is based in Cádiz, Spain.		Sanlúcar de Barrameda 	11540	Fish, salt-water	NA	NA	22	36.77711878771289	-6.352691487524578
spain	agriculture_livestock	animals_livestock	NA	PROTEXPLAGAS-SL_ESP187179-00101	PROTEXPLAGAS SL	Badajoz	11 - 50	veterinary services | livestock - services	Registered office	FALSE			The company PROTEXPLAGAS SL, which operates in the Livestock - services industry. It also operates in the Veterinary services industries. It is based in Badajoz, Spain.	http://www.protexplagas.com	Industrial El Nevero - Nav 24 Par H, 5 	06006	Livestock - services, Veterinary services	NA	NA	22	38.884670875000005	-7.000773673186379
spain	agriculture_livestock	animals_livestock	NA	COMERCIAL-PECUARIA-SEGOVIANA-SA_ESP007709-00101	COMERCIAL PECUARIA SEGOVIANA SA	Sepulveda	51 - 100	premix for livestock and poultry | feeds for animal farming	Registered office	FALSE		Manufacturer/ Producer	The company COMERCIAL PECUARIA SEGOVIANA SA, is a Manufacturer/ Producer, which operates in the Feeds for animal farming industry. It also operates in the Premix for livestock and poultry industries. It is based in Sepulveda, Spain.	http://www.copese.net	Conde Sepulveda, 24 	40300	Feeds for animal farming, Premix for livestock and poultry	NA	NA	22	41.29923785	-3.7428552130542134
spain	agriculture_livestock	animals_livestock	NA	LERIDANA-DE-PIENSOS-SA_ESP006990-00101	LERIDANA DE PIENSOS SA	Lleida	101 - 200	premix for livestock and poultry | feeds for animal farming	Registered office	FALSE		Manufacturer/ Producer	The company LERIDANA DE PIENSOS SA, is a Manufacturer/ Producer, which operates in the Feeds for animal farming industry. It also operates in the Premix for livestock and poultry industries. It is based in Lleida, Spain.	http://www.leridanadepiensos.com	Nacional 230 (Km 5,6) 	25196	Feeds for animal farming, Premix for livestock and poultry	NA	NA	22	41.65242810359437	0.606873761272871
spain	agriculture_livestock	animals_livestock	NA	GRUP-BAUCELLS-ALIMENTACIO-SA_ESP030201-00101	GRUP BAUCELLS ALIMENTACIO SA.	Vic	201 - 500	premix for livestock and poultry | feeds for animal farming	Registered office	FALSE	1942	Manufacturer/ Producer	The company GRUP BAUCELLS ALIMENTACIO SA., is a Manufacturer/ Producer, founded in 1942, which operates in the Feeds for animal farming industry. It also operates in the Premix for livestock and poultry industries. It is based in Vic, Spain.	http://www.grupbaucells.com	Moli Del Llobet (Pol Ind Malloles), 53 	08500	Feeds for animal farming, Premix for livestock and poultry	NA	NA	22	41.931540934746266	2.2472385770921353
spain	agriculture_livestock	animals_livestock	NA	AVESCAL-SERVICIO-VETERINARIOS-SDAD-COOPERATIVA_ESP142104-00101	AVESCAL SERVICIO VETERINARIOS SDAD COOPERATIVA	Valladolid	201 - 500	veterinary services | livestock - services	Registered office	FALSE		Service Provider	The company AVESCAL SERVICIO VETERINARIOS SDAD COOPERATIVA, is a Service Provider, which operates in the Livestock - services industry. It also operates in the Veterinary services industries. It is based in Valladolid, Spain.		Calle Canovas Del Castillo 4 	47002	Livestock - services, Veterinary services	NA	NA	22	41.65072603837209	-4.722428838839386
spain	agriculture_livestock	animals_livestock	NA	APM-SPAIN_00000003775465-132923001	APM SPAIN	bullas	> 500	calves and cattle, slaughter		FALSE		Manufacturer/ Producer	The company APM SPAIN, is a Manufacturer/ Producer, which operates in the Calves and cattle, slaughter industry. It is based in bullas, Spain.	http://www.apmspain.com	c/valle guadalentin nº2 pl.1of.1 	30180	Calves and cattle, slaughter	NA	NA	22	38.0514259	-1.6629599623735274
spain	agriculture_livestock	animals_livestock	NA	COOPERATIVA-GUVAC-GANADEROS-UNIDOS-DEL-VALLE-DE-CARRANZA-SOC-COOP-LTDA_ESP025115-00101	COOPERATIVA GUVAC GANADEROS UNIDOS DEL VALLE DE CARRANZA SOC COOP LTDA	Carranza	11 - 50	premix for livestock and poultry | feeds for animal farming	Registered office	FALSE		Manufacturer/ Producer	The company COOPERATIVA GUVAC GANADEROS UNIDOS DEL VALLE DE CARRANZA SOC COOP LTDA, is a Manufacturer/ Producer, which operates in the Feeds for animal farming industry. It also operates in the Premix for livestock and poultry industries. It is based in Carranza, Spain.	http://www.cooperativaguvac.com	Barrio Ambasaguas 	48891	Feeds for animal farming, Premix for livestock and poultry	NA	NA	22	43.20473687682923	-3.4134442574713053
spain	agriculture_livestock	animals_livestock	NA	BIBIANO-Y-CIA-SL_ESP081753-00101	BIBIANO Y CIA SL	Cartagena	51 - 100	premix for livestock and poultry | feeds for animal farming	Registered office	FALSE		Manufacturer/ Producer	The company BIBIANO Y CIA SL, is a Manufacturer/ Producer, which operates in the Feeds for animal farming industry. It also operates in the Premix for livestock and poultry industries. It is based in Cartagena, Spain.	http://www.carm.es	Al Albujon (Pozo Estrecho), S/N 	30594	Feeds for animal farming, Premix for livestock and poultry	NA	NA	22	37.7115917	-0.9918895
spain	agriculture_livestock	animals_livestock	NA	COOP-DE-AVICULTORES-Y-GANADEROS-VALENCIANA-COOP-V_ESP011419-00101	COOP DE AVICULTORES Y GANADEROS VALENCIANA COOP V	Silla	11 - 50	grains, livestock and poultry | fish meal for livestock and poultry | premix for livestock and poultry	Registered office	FALSE		Manufacturer/ Producer	The company COOP DE AVICULTORES Y GANADEROS VALENCIANA COOP V, is a Manufacturer/ Producer, which operates in the Premix for livestock and poultry industry. It also operates in the Fish meal for livestock and poultry, and Grains, livestock and poultry industries. It is based in Silla, Spain.		Avenida Espioca 88 	46460	Premix for livestock and poultry, Fish meal for livestock and poultry, Grains, livestock and poultry	NA	NA	22	39.36242613215793	-0.4117556458923818
spain	agriculture_livestock	animals_livestock	NA	SDAD-COOP-AGROPECUARIA-DEL-NORTE-DE-LA-CORUNA_ESP016644-00101	SDAD COOP AGROPECUARIA DEL NORTE DE LA CORUNA	Valdovino	11 - 50	premix for livestock and poultry | feeds for animal farming	Registered office	FALSE		Manufacturer/ Producer	The company SDAD COOP AGROPECUARIA DEL NORTE DE LA CORUNA, is a Manufacturer/ Producer, which operates in the Premix for livestock and poultry industry. It also operates in the Feeds for animal farming industries. It is based in Valdovino, Spain.		Lugar Rioboo Meiras 	15552	Premix for livestock and poultry, Feeds for animal farming	NA	NA	22	43.609236936878496	-8.146034160655004
spain	agriculture_livestock	animals_livestock	NA	LOTUSMINE-CHEM_00000004659538-460753001	LOTUSMINE CHEM	Getafe, Madrid	51 - 100	premix for livestock and poultry		FALSE		Manufacturer/ Producer	The company LOTUSMINE CHEM, is a Manufacturer/ Producer, which operates in the Premix for livestock and poultry industry. It is based in Getafe, Madrid, Spain.	http://www.lotusminechem.com/	Calle Madrid 69 	28901	Premix for livestock and poultry	NA	NA	22	40.30595826458333	-3.7301734636174557
spain	agriculture_livestock	animals_livestock	NA	DOGGY-KIT-FOR-THE-CITY-SL_ESP190607-00101	DOGGY KIT FOR THE CITY SL	Madrid		dogs and cats - articles for | pet supplies		FALSE			The company DOGGY KIT FOR THE CITY SL, which operates in the Pet supplies industry. It also operates in the Dogs and cats - articles for industries. It is based in Madrid, Spain.	http://www.doggykit.com	Conde De Aranda, 8 	28001	Pet supplies, Dogs and cats - articles for	NA	NA	22	40.42735948254582	-3.683459742338485
spain	agriculture_livestock	animals_livestock	NA	IBERPROTEIN-SL_ESP147760-00101	IBERPROTEIN S.L.	Valencia	1 - 10	premix for livestock and poultry | feeds for animal farming	Registered office	FALSE		Service Provider	The company IBERPROTEIN S.L., is a Service Provider, which operates in the Feeds for animal farming industry. It also operates in the Premix for livestock and poultry industries. It is based in Valencia, Spain.		Avenida Puerto 105 	46022	Feeds for animal farming, Premix for livestock and poultry	NA	NA	22	39.47357840727724	-0.3403229718369699
spain	agriculture_livestock	animals_livestock	NA	COPIRAL-SL_ESP161776-00101	COPIRAL S.L.	Agramunt	11 - 50	cat food	Registered office	FALSE			The company COPIRAL S.L., which operates in the Cat food industry. It is based in Agramunt, Spain.	http://www.copiral.com	De Tarrega, S/n 	25310	Cat food	NA	NA	22	41.78602490625	1.0974599246230536
spain	agriculture_livestock	animals_livestock	NA	EXPLOTACIONES-GANADERAS-EL-CRUCE-SL_ESP157387-00101	EXPLOTACIONES GANADERAS EL CRUCE SL	Badajoz	51 - 100	aquaculture and pisciculture | fish	Registered office	FALSE			The company EXPLOTACIONES GANADERAS EL CRUCE SL, which operates in the Fish industry. It also operates in the Aquaculture and pisciculture industries. It is based in Badajoz, Spain.	http://www.granjaelcruce.com	Antonio Nevado Gonzalez -Pg El Never P610, S/N 	06007	Fish, Aquaculture and pisciculture	NA	NA	22	38.8905646525	-6.976343830617805
spain	agriculture_livestock	animals_livestock	NA	GRUP-BAUCELLS-ALIMENTACIO-SA_ESP030201-00101	GRUP BAUCELLS ALIMENTACIO SA.	Vic	201 - 500	premix for livestock and poultry | feeds for animal farming	Registered office	FALSE	1942	Manufacturer/ Producer	The company GRUP BAUCELLS ALIMENTACIO SA., is a Manufacturer/ Producer, founded in 1942, which operates in the Feeds for animal farming industry. It also operates in the Premix for livestock and poultry industries. It is based in Vic, Spain.	http://www.grupbaucells.com	Moli Del Llobet (Pol Ind Malloles), 53 	08500	Feeds for animal farming, Premix for livestock and poultry	NA	NA	22	41.931540934746266	2.2472385770921353
spain	agriculture_livestock	animals_livestock	NA	AVESCAL-SERVICIO-VETERINARIOS-SDAD-COOPERATIVA_ESP142104-00101	AVESCAL SERVICIO VETERINARIOS SDAD COOPERATIVA	Valladolid	201 - 500	veterinary services | livestock - services	Registered office	FALSE		Service Provider	The company AVESCAL SERVICIO VETERINARIOS SDAD COOPERATIVA, is a Service Provider, which operates in the Livestock - services industry. It also operates in the Veterinary services industries. It is based in Valladolid, Spain.		Calle Canovas Del Castillo 4 	47002	Livestock - services, Veterinary services	NA	NA	22	41.65072603837209	-4.722428838839386
spain	agriculture_livestock	animals_livestock	NA	COOPERATIVA-GUVAC-GANADEROS-UNIDOS-DEL-VALLE-DE-CARRANZA-SOC-COOP-LTDA_ESP025115-00101	COOPERATIVA GUVAC GANADEROS UNIDOS DEL VALLE DE CARRANZA SOC COOP LTDA	Carranza	11 - 50	premix for livestock and poultry | feeds for animal farming	Registered office	FALSE		Manufacturer/ Producer	The company COOPERATIVA GUVAC GANADEROS UNIDOS DEL VALLE DE CARRANZA SOC COOP LTDA, is a Manufacturer/ Producer, which operates in the Feeds for animal farming industry. It also operates in the Premix for livestock and poultry industries. It is based in Carranza, Spain.	http://www.cooperativaguvac.com	Barrio Ambasaguas 	48891	Feeds for animal farming, Premix for livestock and poultry	NA	NA	22	43.20473687682923	-3.4134442574713053
spain	agriculture_livestock	animals_livestock	NA	PIENSOS-COMPUESTOS-VICTORIA-SA_ESP034239-00101	PIENSOS COMPUESTOS VICTORIA SA	Vic	11 - 50	premix for livestock and poultry | feeds for animal farming	Registered office	FALSE		Manufacturer/ Producer	The company PIENSOS COMPUESTOS VICTORIA SA, is a Manufacturer/ Producer, which operates in the Feeds for animal farming industry. It also operates in the Premix for livestock and poultry industries. It is based in Vic, Spain.	http://www.pinsosvictoria.com	C- 17 - 34, 32 	08500	Feeds for animal farming, Premix for livestock and poultry	NA	NA	22	41.931540934746266	2.2472385770921353
spain	agriculture_livestock	animals_livestock	NA	BAENAS-EXPORTIMPORT-SL_ESP146204-00101	BAENAS EXPORT-IMPORT S.L.	Lorca	1 - 10	calves and cattle, slaughter | cattle	Registered office	FALSE		Wholesaler	The company BAENAS EXPORT-IMPORT S.L., is a Wholesaler, which operates in the Cattle industry. It also operates in the Calves and cattle, slaughter industries. It is based in Lorca, Spain.		Calle Purias, S/N 	30800	Cattle, Calves and cattle, slaughter	NA	NA	22	37.904515033333325	-1.7100220935142938
spain	agriculture_livestock	animals_livestock	NA	LERIDANA-DE-PIENSOS-SA_ESP006990-00101	LERIDANA DE PIENSOS SA	Lleida	101 - 200	premix for livestock and poultry | feeds for animal farming	Registered office	FALSE		Manufacturer/ Producer	The company LERIDANA DE PIENSOS SA, is a Manufacturer/ Producer, which operates in the Feeds for animal farming industry. It also operates in the Premix for livestock and poultry industries. It is based in Lleida, Spain.	http://www.leridanadepiensos.com	Nacional 230 (Km 5,6) 	25196	Feeds for animal farming, Premix for livestock and poultry	NA	NA	22	41.65242810359437	0.606873761272871
spain	agriculture_livestock	animals_livestock	NA	GRUPCARN-SA_00000003734763-121699001	GRUPCARN S.A.	SABADELL	1 - 10	calves and cattle, slaughter	Registered office	FALSE		Manufacturer/ Producer	The company GRUPCARN S.A., is a Manufacturer/ Producer, which operates in the Calves and cattle, slaughter industry. It is based in SABADELL, Spain.		CALLE COSTA I DEU 115-125 	08415	Calves and cattle, slaughter	NA	NA	22	41.67408173235294	2.2066662220224322
spain	agriculture_livestock	animals_livestock	NA	DIVALEKISA-SL_00000003656387-95995001	DIVAL-EKISA, S.L.	Carlet (valencia)	1 - 10	pet birds		FALSE		Manufacturer/ Producer	The company DIVAL-EKISA, S.L., is a Manufacturer/ Producer, which operates in the Pet birds industry. It is based in Carlet (valencia), Spain.	http://www.dival-ekisa.com	C/ Llevant, 12 	46240	Pet birds	NA	NA	22	39.22561615555556	-0.5227778177021052
spain	agriculture_livestock	animals_livestock	NA	FRIGORIFICOS-FANDINO-SA_ESP005343-00101	FRIGORIFICOS FANDINO SA	Vigo	51 - 100	fish, salt-water | fish	Registered office	FALSE		Wholesaler	The company FRIGORIFICOS FANDINO SA, is a Wholesaler, which operates in the Fish, salt-water industry. It also operates in the Fish industries. It is based in Vigo, Spain.	http://www.fandino.es	Jose Rivas (Coruxo), 21 	36330	Fish, salt-water, Fish	NA	NA	22	42.1907689	-8.776290905769395
spain	agriculture_livestock	animals_livestock	NA	BORSAO-IMPORTEXPORT-SL_00000003567475-68384001	BORSAO IMPORT-EXPORT SL	Madrid	1 - 10	fish, salt-water | frozen seafood		FALSE		Distributor	The company BORSAO IMPORT-EXPORT SL, is a Distributor, which operates in the Fish, salt-water industry. It also operates in the frozen seafood industries. It is based in Madrid, Spain.		Pl. Mariano De Cavia, 1 	28007	Fish, salt-water, frozen seafood	NA	NA	22	40.40730407051379	-3.672130008030556
spain	agriculture_livestock	animals_livestock	NA	ACUABIERZO-SL_ESP004922-00101	ACUABIERZO S.L.	Cacabelos	11 - 50	dog food | cat food | pets		FALSE		Service Provider	The company ACUABIERZO S.L., is a Service Provider, which operates in the Pets industry. It also operates in the Cat food, and Dog food industries. It is based in Cacabelos, Spain.		Angel Gonzalez, 23 	24540	Pets, Cat food, Dog food	NA	NA	22	42.59903069891736	-6.72424612486991
spain	agriculture_livestock	animals_livestock	NA	BOGRAO-SL_ESP007447-00101	BOGRAO S.L.	Vedra	11 - 50	premix for livestock and poultry | feeds for animal farming		FALSE		Manufacturer/ Producer	The company BOGRAO S.L., is a Manufacturer/ Producer, which operates in the Feeds for animal farming industry. It also operates in the Premix for livestock and poultry industries. It is based in Vedra, Spain.	http://www.labralia.com	Iglesia Merin, 14 	15885	Feeds for animal farming, Premix for livestock and poultry	NA	NA	22	42.81528957900665	-8.534108704334074
spain	agriculture_livestock	animals_livestock	NA	MACROPESCA-SA_ESP133313-00101	MACROPESCA SA	Getafe	11 - 50	aquaculture and pisciculture | fish	Registered office	FALSE		Manufacturer/ Producer	The company MACROPESCA SA, is a Manufacturer/ Producer, which operates in the Fish industry. It also operates in the Aquaculture and pisciculture industries. It is based in Getafe, Spain.	http://www.macropesca.es	Andalucia (Km 13 600) 	28906	Fish, Aquaculture and pisciculture	NA	NA	22	40.31317526770791	-3.6984844549227156
spain	agriculture_livestock	animals_livestock	NA	INVE-ANIMAL-HEALTH-SA_ESP064266-00101	INVE ANIMAL HEALTH SA	Vigo	1 - 10	aquaculture and pisciculture | fish | pet foods	Registered office	FALSE		Wholesaler	The company INVE ANIMAL HEALTH SA, is a Wholesaler, which operates in the Fish industry. It also operates in the Aquaculture and pisciculture, and Pet foods industries. It is based in Vigo, Spain.		Carretera Camposancos 117 	36213	Fish, Aquaculture and pisciculture, Pet foods	NA	NA	22	42.203854385	-8.740031778567397
spain	agriculture_livestock	animals_livestock	NA	FINCA-LA-PEDROSA-SA_ESP007399-00101	FINCA LA PEDROSA SA	Valladolid	11 - 50	cattle, dairy | cattle	Registered office	FALSE		Wholesaler	The company FINCA LA PEDROSA SA, is a Wholesaler, which operates in the Cattle industry. It also operates in the Cattle, dairy industries. It is based in Valladolid, Spain.		Fuensaldana Km 4 	47009	Cattle, Cattle, dairy	NA	NA	22	41.662022021484376	-4.7354394640129645
